{
  "product_id": "wired-macro-pad-v1",
  "hardware_id": "WMP-S3-REV-A",
  "schema_version": 1,
  "created_by": "firmware-default/3",
  "active_profile": 0,
  "profiles": [
    {
      "id": 0,
      "name": "Codex macOS",
      "mappings": [
        {"control_id":"key.1","short_name":"New task","action":{"type":"key","usage":17,"modifiers":[227]}},
        {"control_id":"key.2","short_name":"Commands","action":{"type":"key","usage":14,"modifiers":[227]}},
        {"control_id":"key.3","short_name":"Mic hold","action":{"type":"key","usage":7,"modifiers":[224,225]}},
        {"control_id":"key.4","short_name":"Send","action":{"type":"key","usage":40,"modifiers":[]}},
        {"control_id":"key.5","short_name":"Stop","action":{"type":"key","usage":41,"modifiers":[]}},
        {"control_id":"key.6","short_name":"New line","action":{"type":"key","usage":40,"modifiers":[225]}},
        {"control_id":"key.7","short_name":"Backspace","action":{"type":"key","usage":42,"modifiers":[]}},
        {"control_id":"encoder.ccw","short_name":"Scroll up","action":{"type":"mouse","button":0,"x":0,"y":0,"wheel":1,"pan":0}},
        {"control_id":"encoder.cw","short_name":"Scroll down","action":{"type":"mouse","button":0,"x":0,"y":0,"wheel":-1,"pan":0}},
        {"control_id":"encoder.press","short_name":"Latest","action":{"type":"key","usage":77,"modifiers":[]}},
        {"control_id":"joystick.up","short_name":"Page up","action":{"type":"key","usage":75,"modifiers":[]}},
        {"control_id":"joystick.down","short_name":"Page down","action":{"type":"key","usage":78,"modifiers":[]}},
        {"control_id":"joystick.left","short_name":"Prev task","action":{"type":"key","usage":47,"modifiers":[225,227]}},
        {"control_id":"joystick.right","short_name":"Next task","action":{"type":"key","usage":48,"modifiers":[225,227]}},
        {"control_id":"joystick.press","short_name":"To composer","action":{"type":"key","usage":81,"modifiers":[227]}}
      ]
    },
    {
      "id": 1,
      "name": "Codex Windows",
      "mappings": [
        {"control_id":"key.1","short_name":"New task","action":{"type":"key","usage":17,"modifiers":[224]}},
        {"control_id":"key.2","short_name":"Commands","action":{"type":"key","usage":14,"modifiers":[224]}},
        {"control_id":"key.3","short_name":"Mic hold","action":{"type":"key","usage":7,"modifiers":[224,225]}},
        {"control_id":"key.4","short_name":"Send","action":{"type":"key","usage":40,"modifiers":[]}},
        {"control_id":"key.5","short_name":"Stop","action":{"type":"key","usage":41,"modifiers":[]}},
        {"control_id":"key.6","short_name":"New line","action":{"type":"key","usage":40,"modifiers":[225]}},
        {"control_id":"key.7","short_name":"Backspace","action":{"type":"key","usage":42,"modifiers":[]}},
        {"control_id":"encoder.ccw","short_name":"Scroll up","action":{"type":"mouse","button":0,"x":0,"y":0,"wheel":1,"pan":0}},
        {"control_id":"encoder.cw","short_name":"Scroll down","action":{"type":"mouse","button":0,"x":0,"y":0,"wheel":-1,"pan":0}},
        {"control_id":"encoder.press","short_name":"Latest","action":{"type":"key","usage":77,"modifiers":[224]}},
        {"control_id":"joystick.up","short_name":"Page up","action":{"type":"key","usage":75,"modifiers":[]}},
        {"control_id":"joystick.down","short_name":"Page down","action":{"type":"key","usage":78,"modifiers":[]}},
        {"control_id":"joystick.left","short_name":"Prev task","action":{"type":"key","usage":47,"modifiers":[224,225]}},
        {"control_id":"joystick.right","short_name":"Next task","action":{"type":"key","usage":48,"modifiers":[224,225]}},
        {"control_id":"joystick.press","short_name":"To composer","action":{"type":"key","usage":77,"modifiers":[224]}}
      ]
    }
  ],
  "macros": [],
  "lighting": {
    "enabled": true,
    "brightness": 40,
    "status": [
      {"r":0,"g":16,"b":64},{"r":0,"g":16,"b":64},{"r":0,"g":16,"b":64},{"r":0,"g":16,"b":64},
      {"r":0,"g":16,"b":64},{"r":0,"g":16,"b":64},{"r":0,"g":16,"b":64},{"r":0,"g":16,"b":64}
    ],
    "under_key": [
      {"r":0,"g":16,"b":64},{"r":32,"g":0,"b":64},{"r":0,"g":48,"b":64},{"r":0,"g":64,"b":16},
      {"r":64,"g":0,"b":0},{"r":64,"g":32,"b":0},{"r":48,"g":40,"b":0}
    ]
  },
  "haptic": {"enabled":true,"strength":60,"duration_ms":120,"on_press":true,"on_profile":true,"on_encoder":true,"on_joystick":true,"on_task":true},
  "display": {"brightness":60,"rotation":0,"show_control_hints":true},
  "joystick": {
    "calibrated": false,
    "filter": 25,
    "x": {"minimum":200,"center":2048,"maximum":3895,"deadzone":180,"invert":false},
    "y": {"minimum":200,"center":2048,"maximum":3895,"deadzone":180,"invert":false}
  }
}
