{
  "product_id": "wired-macro-pad-v1",
  "hardware_id": "WMP-S3-REV-A",
  "schema_version": 1,
  "created_by": "firmware-default/devkit",
  "active_profile": 0,
  "profiles": [
    {
      "id": 0,
      "name": "Engineering",
      "mappings": [
        {"control_id":"key.1","short_name":"New task","action":{"type":"key","usage":17,"modifiers":[227]}}
      ]
    }
  ],
  "macros": [],
  "lighting": {
    "enabled": true,
    "brightness": 40,
    "status": [
      {"r":0,"g":16,"b":64},{"r":0,"g":16,"b":64},{"r":0,"g":16,"b":64},{"r":0,"g":16,"b":64},
      {"r":0,"g":16,"b":64},{"r":0,"g":16,"b":64},{"r":0,"g":16,"b":64},{"r":0,"g":16,"b":64}
    ],
    "under_key": [
      {"r":0,"g":16,"b":64},{"r":32,"g":0,"b":64},{"r":0,"g":48,"b":64},{"r":0,"g":64,"b":16},
      {"r":64,"g":0,"b":0},{"r":64,"g":32,"b":0},{"r":48,"g":40,"b":0}
    ]
  },
  "haptic": {"enabled":true,"strength":60,"duration_ms":120,"on_press":true,"on_profile":true,"on_encoder":true,"on_joystick":true,"on_task":true},
  "display": {"brightness":60,"rotation":0,"show_control_hints":true},
  "joystick": {
    "calibrated": false,
    "filter": 25,
    "x": {"minimum":200,"center":2048,"maximum":3895,"deadzone":180,"invert":false},
    "y": {"minimum":200,"center":2048,"maximum":3895,"deadzone":180,"invert":false}
  }
}
